{
  "$schema": "https://json-schema.org/draft/2020-12/schema",
  "$id": "https://webgamefactory.dev/schemas/artifacts/asset-manifest.schema.json",
  "title": "Asset Manifest",
  "description": "Every asset the game needs, its source, its cost, and its status.\n\nThis is an ARTIFACT, not a stage. There is deliberately no asset-production state: serializing art behind a gate would put code behind art and wreck a 7-14 day schedule. Asset work happens inside prototype and production, tracked here as line-item status, and `complete` becomes a guard on production exit.\n\nIt is authored during design because asset cost is an input to the scope decision — and an input cannot be produced downstream of the decision it feeds.",

  "x-wgf": {
    "id": "asset-manifest",
    "kind": "artifact",
    "format": "json",
    "version": "1.5.0",
    "producer": "title:prototype",
    "updated_by": ["title:design", "title:tech-plan", "title:production"],
    "consumers": ["title:tech-plan", "title:prototype", "title:production", "release:qa", "release:draft", "release:store-listing"],
    "repo_path": "workspace/titles/<title-id>/asset-manifest.json",
    "run_path": "<storage>/workflows/<run-id>/artifacts/asset-manifest/v<n>.json",
    "required_for_gates": []
  },

  "type": "object",
  "required": ["provenance", "title_id", "items", "total_est_cost", "total_est_hours", "complete"],
  "properties": {
    "provenance": { "$ref": "./shared/provenance.schema.json#/$defs/provenance" },
    "title_id": { "type": "string" },

    "items": {
      "type": "array",
      "items": {
        "type": "object",
        "required": ["id", "type", "source", "est_cost", "est_hours", "status"],
        "properties": {
          "id": { "type": "string", "pattern": "^[a-z][a-z0-9-]*$" },
          "label": { "type": "string" },
          "type": {
            "enum": ["sprite", "spritesheet", "background", "tileset", "texture", "material", "model", "animation", "environment", "vfx", "sfx", "music", "font", "ui", "icon", "screenshot", "other"]
          },
          "dimension": {
            "enum": ["2d", "3d"],
            "description": "Which renderer the asset is for. Audio and fonts take the game's dimension."
          },
          "source": {
            "enum": ["library", "procedural", "ai-generated", "purchased", "commissioned"],
            "description": "Drives both cost and licensing risk. Library and procedural are the cheap paths and should be preferred at this scale."
          },
          "est_cost": { "type": "number", "minimum": 0 },
          "est_hours": { "type": "number", "minimum": 0 },
          "status": {
            "enum": ["planned", "sourced", "in-progress", "delivered", "integrated", "cut"]
          },
          "license": {
            "type": "string",
            "description": "An SPDX identifier, or a LicenseRef- id from core/reference/asset-policy.yaml. Required before a purchased, library or commissioned asset can be integrated. An unlicensed asset in a published build is a real liability, not a paperwork detail."
          },
          "license_status": {
            "enum": ["generated", "verified", "restricted", "unknown"],
            "description": "The license classified against core/reference/asset-policy.yaml. generated: made by the Factory, owing nobody. verified: a permitted license with a recorded origin. restricted: a license the policy forbids in a published build. unknown: missing or unrecognised, and treated exactly like missing."
          },
          "usage_constraints": {
            "type": "array",
            "items": { "type": "string" },
            "description": "What using the asset obliges - attribution, share-alike, keep-receipt - from the license's policy entry plus anything the source adds."
          },
          "origin": {
            "type": "object",
            "description": "Where the asset came from. Required in substance for every asset the Factory did not generate: without it a license is an assertion nobody can check.",
            "required": ["kind"],
            "properties": {
              "kind": { "enum": ["generated", "library", "external"] },
              "generator": { "type": "string", "description": "For a generated asset, the backend that made it." },
              "library_id": { "type": "string", "description": "For a library asset, its entry in the library index." },
              "source_url": { "type": "string" },
              "author": { "type": "string" },
              "vendor": { "type": "string" },
              "attribution": { "type": "string", "description": "The credits line, verbatim, when the license requires one." },
              "license_url": { "type": "string" },
              "acquired_at": { "type": "string", "format": "date-time" },
              "evidence": { "type": "string", "description": "Where the proof of license lives: a receipt, a contract, an archived page." }
            },
            "additionalProperties": false
          },
          "placeholder": {
            "type": "boolean",
            "description": "A stand-in generated so code is not blocked on art. Never production-ready."
          },
          "production_ready": {
            "type": "boolean",
            "description": "Valid, license-cleared and not a placeholder. Always false when license_status is unknown or restricted: unknown licensing must not silently become a production asset."
          },
          "files": {
            "type": "array",
            "description": "The delivered files, relative to the game repository root. A spritesheet has an image and its atlas.",
            "items": {
              "type": "object",
              "required": ["path", "format", "bytes", "content_hash"],
              "properties": {
                "path": { "type": "string" },
                "format": { "type": "string" },
                "bytes": { "type": "integer", "minimum": 0 },
                "content_hash": { "$ref": "./shared/provenance.schema.json#/$defs/hash" },
                "width": { "type": "integer", "minimum": 0 },
                "height": { "type": "integer", "minimum": 0 }
              },
              "additionalProperties": false
            }
          },
          "atlas": {
            "type": "object",
            "description": "The atlas this asset was packed into and its frame there. Its own file (under src/assets/) is the source; the atlas is what ships.",
            "required": ["id", "frame"],
            "properties": {
              "id": { "type": "string", "pattern": "^[a-z][a-z0-9-]*$" },
              "frame": { "type": "string" }
            },
            "additionalProperties": false
          },
          "scale": {
            "type": "integer",
            "minimum": 2,
            "maximum": 4,
            "description": "The resolution the pixels were authored at, when not 1x: a 2x asset has twice the pixels of its logical size."
          },
          "reference": {
            "type": "string",
            "description": "For an asset delivered as a named fallback rather than a file, such as a system font stack."
          },
          "model": { "$ref": "#/$defs/model" },
          "optimization": {
            "type": "object",
            "properties": {
              "applied": { "type": "array", "items": { "type": "string" }, "description": "Lossless steps already done to the delivered files." },
              "deferred": { "type": "array", "items": { "type": "string" }, "description": "Pipeline steps still owed, from the policy's optimize list." },
              "bytes_saved": { "type": "integer", "minimum": 0 }
            },
            "additionalProperties": false
          },
          "issues": {
            "type": "array",
            "items": { "type": "string" },
            "description": "Issue codes on this item. The details are in the manifest's issues list."
          },
          "scope_tier": { "enum": ["mvp", "prototype", "production", "future"] },
          "platforms": { "type": "array", "items": { "type": "string" } },
          "notes": { "type": "string" },
          "role": { "enum": ["player", "threat", "goal", "target", "projectile", "collectible", "hazard", "environment", "background", "prop", "ui", "vfx", "icon", "font"], "description": "The requirement's role (game-design build_spec.assets[].role)." },
          "quality": {
            "type": "object",
            "description": "Whether the delivered files are production art and not a stand-in: checks on the files themselves (an SVG's shapes and palette, a GLB's parts, normals, materials and whether it is one primitive). A placeholder, or an mvp item whose quality is not `pass`, never reaches a release.",
            "required": ["verdict", "checks"],
            "properties": {
              "verdict": { "enum": ["pass", "fail", "skipped"] },
              "checks": { "type": "array", "items": { "type": "object", "required": ["id", "status", "summary"], "properties": { "id": { "type": "string" }, "status": { "enum": ["pass", "fail", "skipped"] }, "summary": { "type": "string" } }, "additionalProperties": false } },
              "primitive_only": { "type": ["boolean", "null"], "description": "3D: the model is one box, sphere, cylinder, capsule or plane (or several unmodified ones). 2D: the image is one plain rectangle or circle." },
              "parts": { "type": ["integer", "null"], "minimum": 0 },
              "triangles": { "type": ["integer", "null"], "minimum": 0 },
              "colors": { "type": ["integer", "null"], "minimum": 0 },
              "author": { "type": ["string", "null"], "description": "What made it: library:<id>, author:<kind>, builtin:<generator>, placeholder." }
            },
            "additionalProperties": false
          }
        },
        "additionalProperties": false
      }
    },

    "pipeline": {
      "type": "object",
      "description": "How source assets become runtime assets. 3D adds compression steps that materially change load time on mobile web.",
      "properties": {
        "2d": { "type": "string" },
        "3d": { "type": "string" },
        "texture_compression": { "type": "array", "items": { "type": "string" } },
        "mesh_compression": { "type": "array", "items": { "type": "string" } },
        "audio_format": { "type": "array", "items": { "type": "string" } }
      },
      "additionalProperties": false
    },

    "total_est_cost": { "type": "number", "minimum": 0 },
    "total_est_hours": { "type": "number", "minimum": 0 },
    "budget": { "type": ["number", "null"] },

    "complete": {
      "type": "boolean",
      "description": "True when every non-cut item is integrated. Part of the content_complete guard on production exit — which is why CONTENT COMPLETE is not a lifecycle state."
    },

    "policy": {
      "type": "object",
      "description": "The asset policy the items were classified against, pinned by hash so a re-classification is visible.",
      "required": ["id", "version"],
      "properties": {
        "id": { "type": "string" },
        "version": { "type": "string" },
        "content_hash": { "$ref": "./shared/provenance.schema.json#/$defs/hash" }
      },
      "additionalProperties": false
    },

    "atlases": {
      "type": "array",
      "description": "Texture atlases packed from the items' atlas groups, in group order.",
      "items": {
        "type": "object",
        "required": ["id", "files", "members"],
        "properties": {
          "id": { "type": "string", "pattern": "^[a-z][a-z0-9-]*$" },
          "files": {
            "type": "array",
            "items": {
              "type": "object",
              "required": ["path", "format", "bytes", "content_hash"],
              "properties": {
                "path": { "type": "string" },
                "format": { "type": "string" },
                "bytes": { "type": "integer", "minimum": 0 },
                "content_hash": { "$ref": "./shared/provenance.schema.json#/$defs/hash" },
                "width": { "type": "integer", "minimum": 0 },
                "height": { "type": "integer", "minimum": 0 }
              },
              "additionalProperties": false
            }
          },
          "members": { "type": "array", "items": { "type": "string" } }
        },
        "additionalProperties": false
      }
    },

    "runtime_manifest": {
      "type": "object",
      "description": "The runtime asset manifest written into the game repository (shared/runtime-assets.schema.json): what game code loads assets through.",
      "required": ["path", "bytes", "content_hash"],
      "properties": {
        "path": { "type": "string" },
        "bytes": { "type": "integer", "minimum": 0 },
        "content_hash": { "$ref": "./shared/provenance.schema.json#/$defs/hash" }
      },
      "additionalProperties": false
    },

    "issues": {
      "type": "array",
      "description": "Everything wrong with the manifest, one entry per problem. An error keeps its item from being production-ready.",
      "items": {
        "type": "object",
        "required": ["code", "severity", "message"],
        "properties": {
          "item_id": { "type": "string" },
          "code": {
            "enum": ["missing", "invalid-format", "format-not-allowed", "too-large", "not-power-of-two", "duplicate-content", "license-unknown", "license-restricted", "provenance-missing", "placeholder", "generation-failed", "library-candidate-rejected", "over-budget", "over-bundle-size", "unsafe-svg", "texture-too-large", "transparency-mismatch", "dimension-mismatch", "invalid-atlas", "atlas-overflow", "atlas-source-served", "invalid-tileset", "duplicate-path", "not-served", "model-invalid", "model-external-reference", "model-unsupported-extension", "model-needs-decoder", "model-transform", "model-scale", "model-pivot", "model-over-budget", "animation-missing", "animation-invalid", "lod-missing", "lod-invalid", "collision-missing", "model-spec-unbuilt", "quality-failed", "author-rejected", "variants-short", "model-nodes-renamed", "climax-art-unassigned", "climax-art-shared"],
            "description": "Added in 1.5.0: `model-nodes-renamed` (a model remade for a re-entry lost node names the shipped one had; game code that looks parts up by name must follow), `climax-art-unassigned` (a climax content unit names no drawing or model of its own, so distinct climax art cannot be checked) and `climax-art-shared` (two climax units are drawn with one drawing or model, or with drawings that differ only in colour)."
          },
          "severity": { "enum": ["error", "warning", "info"] },
          "message": { "type": "string" }
        },
        "additionalProperties": false
      }
    },

    "generation": {
      "type": "object",
      "description": "Which placeholder backends were tried. An optional backend that is unavailable is recorded, never fatal.",
      "properties": {
        "backends": {
          "type": "array",
          "items": {
            "type": "object",
            "required": ["id", "available"],
            "properties": {
              "id": { "type": "string" },
              "available": { "type": "boolean" },
              "used": { "type": "integer", "minimum": 0 },
              "note": { "type": "string" }
            },
            "additionalProperties": false
          }
        }
      },
      "additionalProperties": false
    }
  },
  "additionalProperties": false,

  "$defs": {
    "vec3": { "type": "array", "items": { "type": "number" }, "minItems": 3, "maxItems": 3 },
    "model": {
      "type": "object",
      "description": "What a GLB item's file holds, read from its bytes: the visual model at rest (LOD0, collision proxies excluded), its clips, levels of detail, collision proxy and embedded textures; and, for a generated model, what built it.",
      "required": ["triangles", "vertices", "nodes", "meshes", "materials", "textures", "animations", "lods", "skins"],
      "properties": {
        "triangles": { "type": "integer", "minimum": 0 },
        "vertices": { "type": "integer", "minimum": 0 },
        "nodes": { "type": "integer", "minimum": 0 },
        "meshes": { "type": "integer", "minimum": 0 },
        "materials": { "type": "array", "items": { "type": "string" } },
        "textures": {
          "type": "array",
          "items": {
            "type": "object",
            "required": ["format"],
            "properties": {
              "format": { "type": "string" },
              "width": { "type": "integer", "minimum": 0 },
              "height": { "type": "integer", "minimum": 0 }
            },
            "additionalProperties": false
          }
        },
        "dimensions": { "$ref": "#/$defs/vec3", "description": "Metres along x, y, z, glTF axes (+Y up)." },
        "bounds": {
          "type": "object",
          "required": ["min", "max"],
          "properties": { "min": { "$ref": "#/$defs/vec3" }, "max": { "$ref": "#/$defs/vec3" } },
          "additionalProperties": false
        },
        "animations": {
          "type": "array",
          "items": {
            "type": "object",
            "required": ["name", "duration", "channels"],
            "properties": {
              "name": { "type": "string" },
              "duration": { "type": "number", "minimum": 0 },
              "channels": { "type": "integer", "minimum": 0 }
            },
            "additionalProperties": false
          }
        },
        "lods": {
          "type": "array",
          "items": {
            "type": "object",
            "required": ["level", "node", "triangles"],
            "properties": {
              "level": { "type": "integer", "minimum": 0 },
              "node": { "type": "string" },
              "triangles": { "type": "integer", "minimum": 0 }
            },
            "additionalProperties": false
          }
        },
        "collision": {
          "type": "object",
          "required": ["node", "shape", "triangles"],
          "properties": {
            "node": { "type": "string" },
            "shape": { "type": "string" },
            "triangles": { "type": "integer", "minimum": 0 }
          },
          "additionalProperties": false
        },
        "skins": { "type": "integer", "minimum": 0 },
        "extensions_used": { "type": "array", "items": { "type": "string" } },
        "extensions_required": { "type": "array", "items": { "type": "string" } },
        "generation": {
          "type": "object",
          "description": "For a generated model: the tool and version that built it, whether that version is the pinned one, and the key a rebuild is compared against.",
          "required": ["tool", "version", "pinned", "reused"],
          "properties": {
            "tool": { "type": "string" },
            "version": { "type": "string" },
            "exporter": { "type": "string" },
            "pinned": { "type": "boolean" },
            "key": { "$ref": "./shared/provenance.schema.json#/$defs/hash" },
            "spec_hash": { "$ref": "./shared/provenance.schema.json#/$defs/hash" },
            "reused": { "type": "boolean", "description": "The file already in the game repository carried this key and was kept; the tool was not run." },
            "export_options_unsupported": { "type": "array", "items": { "type": "string" } }
          },
          "additionalProperties": false
        }
      },
      "additionalProperties": false
    }
  }
}
