{
  "provenance": {
    "artifact_id": "wgf:asset-manifest:ice-slide:20261003-02",
    "artifact_type": "asset-manifest",
    "schema_version": "1.4.0",
    "opportunity_id": "opp-b40899dc",
    "title_id": "ice-slide",
    "produced_by": {
      "role": "asset",
      "actor": "automation"
    },
    "produced_at": "2026-10-03T10:51:10Z",
    "inputs": [
      {
        "artifact_id": "wgf:game-design:ice-slide:20261003-06",
        "artifact_type": "game-design",
        "content_hash": "sha256:54887df7763a4d5d445d0bf2bc17ded2a3eaa84f37542077ecd3486ee41798d8"
      },
      {
        "artifact_id": "wgf:playability-report:ice-slide:20261003-06",
        "artifact_type": "playability-report",
        "content_hash": "sha256:30266ab5243a13923cea2b2a22ef0939f06b03ed4ff1ecff9b9ddaac3cd0cd78"
      },
      {
        "artifact_id": "wgf:production-quality-report:ice-slide:20261003-01",
        "artifact_type": "production-quality-report",
        "content_hash": "sha256:5ada10cc8d00d76ac79cd66295c06ed5d6bdb93b1302147dc508faffd38ff54f"
      },
      {
        "artifact_id": "wgf:scaffold-record:ice-slide:20261003-03",
        "artifact_type": "scaffold-record",
        "content_hash": "sha256:afb8e376cf2c4caa033cf29a39d26d40fa881bf65c68d7e2006a79f8bc853adf"
      }
    ],
    "content_hash": "sha256:78a4edb24651e74a8d4c64e112145f45495aa5323018b367ce7953803a42c614",
    "status": "draft"
  },
  "title_id": "ice-slide",
  "items": [
    {
      "id": "penguin",
      "label": "The player's penguin, with idle, sliding and goal-reached states",
      "type": "sprite",
      "role": "player",
      "dimension": "2d",
      "source": "ai-generated",
      "est_cost": 0,
      "est_hours": 0.5,
      "status": "delivered",
      "license": "LicenseRef-factory-generated",
      "license_status": "generated",
      "origin": {
        "kind": "generated",
        "generator": "author:command"
      },
      "placeholder": false,
      "production_ready": true,
      "quality": {
        "verdict": "pass",
        "checks": [
          {
            "id": "svg.well-formed",
            "status": "pass",
            "summary": "well-formed <svg> with a viewBox"
          },
          {
            "id": "svg.safe",
            "status": "pass",
            "summary": "no script, handler, embedded raster or external reference"
          },
          {
            "id": "svg.not-primitive",
            "status": "pass",
            "summary": "16 drawing element(s); the bar for player is 3"
          },
          {
            "id": "svg.palette",
            "status": "pass",
            "summary": "4 colour(s), 0 off the palette"
          },
          {
            "id": "svg.dimensions",
            "status": "pass",
            "summary": "96x96, aspect 1.00; the spec's 96x96 is 1.00"
          },
          {
            "id": "svg.avoid",
            "status": "pass",
            "summary": "none of the measurable avoid lines ('Neon glow', 'Purple-to-blue gradients on white', 'Emoji as iconography')"
          }
        ],
        "primitive_only": false,
        "parts": 16,
        "colors": 4,
        "author": "author:command"
      },
      "files": [
        {
          "path": "public/assets/sprites/penguin.svg",
          "format": "svg",
          "bytes": 1285,
          "content_hash": "sha256:57f137950b5277a798841f42bb5b704f4b4152b955dbc152fe69b4900f14fc07",
          "width": 96,
          "height": 96
        }
      ],
      "optimization": {
        "applied": [
          "svg-strip"
        ],
        "deferred": [
          "texture-atlas"
        ],
        "bytes_saved": 234
      },
      "scope_tier": "mvp",
      "notes": "Vector character, 96px tall, idle/slide/celebrate states, 4 facing directions"
    },
    {
      "id": "ice-tile",
      "label": "The plain ice floor tile that makes up the board - the surface a slide crosses and the cell it stops on",
      "type": "sprite",
      "role": "target",
      "dimension": "2d",
      "source": "ai-generated",
      "est_cost": 0,
      "est_hours": 0.5,
      "status": "delivered",
      "license": "LicenseRef-factory-generated",
      "license_status": "generated",
      "origin": {
        "kind": "generated",
        "generator": "author:command"
      },
      "placeholder": false,
      "production_ready": true,
      "quality": {
        "verdict": "pass",
        "checks": [
          {
            "id": "svg.well-formed",
            "status": "pass",
            "summary": "well-formed <svg> with a viewBox"
          },
          {
            "id": "svg.safe",
            "status": "pass",
            "summary": "no script, handler, embedded raster or external reference"
          },
          {
            "id": "svg.not-primitive",
            "status": "pass",
            "summary": "9 drawing element(s); the bar for target is 3"
          },
          {
            "id": "svg.palette",
            "status": "pass",
            "summary": "4 colour(s), 0 off the palette"
          },
          {
            "id": "svg.dimensions",
            "status": "pass",
            "summary": "96x96, aspect 1.00; the spec's 96x96 is 1.00"
          },
          {
            "id": "svg.avoid",
            "status": "pass",
            "summary": "none of the measurable avoid lines ('Neon glow', 'Purple-to-blue gradients on white', 'Emoji as iconography')"
          }
        ],
        "primitive_only": false,
        "parts": 9,
        "colors": 4,
        "author": "author:command"
      },
      "files": [
        {
          "path": "public/assets/sprites/ice-tile.svg",
          "format": "svg",
          "bytes": 1077,
          "content_hash": "sha256:0ab4300740abef249927f19051ff18ed9499ef24cbdd6b7967c0d21ac3ea24aa",
          "width": 96,
          "height": 96
        }
      ],
      "optimization": {
        "applied": [
          "svg-strip"
        ],
        "deferred": [
          "texture-atlas"
        ],
        "bytes_saved": 10
      },
      "scope_tier": "mvp",
      "notes": "Vector, 96px, tileable edges Rebuilt for 1 finding(s)."
    },
    {
      "id": "wall-rock",
      "label": "Wall and rock blockers that a slide stops against",
      "type": "sprite",
      "role": "threat",
      "dimension": "2d",
      "source": "ai-generated",
      "est_cost": 0,
      "est_hours": 0.5,
      "status": "delivered",
      "license": "LicenseRef-factory-generated",
      "license_status": "generated",
      "origin": {
        "kind": "generated",
        "generator": "author:command"
      },
      "placeholder": false,
      "production_ready": true,
      "quality": {
        "verdict": "pass",
        "checks": [
          {
            "id": "svg.well-formed",
            "status": "pass",
            "summary": "wall-rock-1: well-formed <svg> with a viewBox"
          },
          {
            "id": "svg.safe",
            "status": "pass",
            "summary": "wall-rock-1: no script, handler, embedded raster or external reference"
          },
          {
            "id": "svg.not-primitive",
            "status": "pass",
            "summary": "wall-rock-1: 12 drawing element(s); the bar for threat is 3"
          },
          {
            "id": "svg.palette",
            "status": "pass",
            "summary": "wall-rock-1: 6 colour(s), 2 off the palette"
          },
          {
            "id": "svg.dimensions",
            "status": "pass",
            "summary": "wall-rock-1: 96x96, aspect 1.00; the spec's 96x96 is 1.00"
          },
          {
            "id": "svg.avoid",
            "status": "pass",
            "summary": "wall-rock-1: none of the measurable avoid lines ('Neon glow', 'Purple-to-blue gradients on white', 'Emoji as iconography')"
          },
          {
            "id": "svg.well-formed",
            "status": "pass",
            "summary": "wall-rock-2: well-formed <svg> with a viewBox"
          },
          {
            "id": "svg.safe",
            "status": "pass",
            "summary": "wall-rock-2: no script, handler, embedded raster or external reference"
          },
          {
            "id": "svg.not-primitive",
            "status": "pass",
            "summary": "wall-rock-2: 10 drawing element(s); the bar for threat is 3"
          },
          {
            "id": "svg.palette",
            "status": "pass",
            "summary": "wall-rock-2: 3 colour(s), 0 off the palette"
          },
          {
            "id": "svg.dimensions",
            "status": "pass",
            "summary": "wall-rock-2: 96x96, aspect 1.00; the spec's 96x96 is 1.00"
          },
          {
            "id": "svg.avoid",
            "status": "pass",
            "summary": "wall-rock-2: none of the measurable avoid lines ('Neon glow', 'Purple-to-blue gradients on white', 'Emoji as iconography')"
          },
          {
            "id": "variants.distinct",
            "status": "pass",
            "summary": "2 drawings, every pair differs; the closest, wall-rock-1 and wall-rock-2, by 0.29 (bar 0.08)"
          }
        ],
        "primitive_only": false,
        "parts": 10,
        "colors": 6,
        "author": "author:command"
      },
      "files": [
        {
          "path": "public/assets/sprites/wall-rock-1.svg",
          "format": "svg",
          "bytes": 1491,
          "content_hash": "sha256:512f9394c62a8da52b331f1d7ccd65c0d82bc5a66cd6f9426cb8274f8f8159bb",
          "width": 96,
          "height": 96
        },
        {
          "path": "public/assets/sprites/wall-rock-2.svg",
          "format": "svg",
          "bytes": 1016,
          "content_hash": "sha256:e2865890cb1778cf3963d8ab0f14571c958936624959b1b7f6c3f164fcd83c97",
          "width": 96,
          "height": 96
        }
      ],
      "optimization": {
        "applied": [
          "svg-strip"
        ],
        "deferred": [
          "texture-atlas"
        ],
        "bytes_saved": 336
      },